{
  "task_id": "kubernetes-001",
  "repository": {
    "name": "kubernetes/kubernetes",
    "commit_sha": "TODO_PIN_COMMIT",
    "languages": ["go"],
    "loc": 36529050,
    "setup_commands": []
  },
  "problem": {
    "description": "Promote component-base metrics to beta",
    "source_pr": "https://github.com/kubernetes/kubernetes/pull/136154",
    "difficulty": "L2",
    "category": "bug_fix",
    "task_type": "cross_module",
    "required_context_files": [
      "staging/src/k8s.io/component-base/metrics/prometheus/controllers/metrics.go",
      "staging/src/k8s.io/component-base/metrics/prometheus/controllers/metrics_test.go",
      "staging/src/k8s.io/component-base/metrics/prometheus/version/metrics.go",
      "staging/src/k8s.io/component-base/metrics/version.go",
      "staging/src/k8s.io/component-base/metrics/version_test.go",
      "test/instrumentation/documentation/documentation-list.yaml",
      "test/instrumentation/documentation/documentation.md",
      "test/instrumentation/testdata/stable-metrics-list.yaml"
    ],
    "estimated_context_tokens": 1490,
    "anti_shortcut_tags": ["retrieval_trap"]
  },
  "ground_truth": {
    "gold_patch": "TODO: extract from PR #136154",
    "test_files": [
      "staging/src/k8s.io/component-base/metrics/prometheus/controllers/metrics_test.go",
      "staging/src/k8s.io/component-base/metrics/version_test.go",
      "test/instrumentation/documentation/documentation-list.yaml",
      "test/instrumentation/documentation/documentation.md",
      "test/instrumentation/testdata/stable-metrics-list.yaml"
    ],
    "verification_command": "TODO",
    "gold_quality_metrics": {
      "patch_locality_score": 0.0,
      "duplication_delta": 0,
      "complexity_delta": 0,
      "import_delta": 0
    }
  },
  "contamination": {
    "has_mutated_variant": false,
    "seed_pr_public": true
  },
  "metadata": {
    "long_context_tier": 1,
    "files_touched": 8,
    "modules_touched": 2,
    "languages_touched": 1,
    "reasoning_chain_length": 2,
    "extracted_by": "pr_mining",
    "human_validated": false
  }
}
