{
  "task_id": "redis-007",
  "repository": {
    "name": "redis/redis",
    "commit_sha": "TODO_PIN_COMMIT",
    "languages": [
      "c"
    ],
    "loc": 0,
    "setup_commands": []
  },
  "problem": {
    "description": "Fix stream_idmp_keys missing from database lifecycle ops",
    "source_pr": "https://github.com/redis/redis/pull/14897",
    "difficulty": "L2",
    "category": "bug_fix",
    "task_type": "cross_module",
    "required_context_files": [
      "src/cluster.c",
      "src/cluster_asm.c",
      "src/db.c",
      "src/lazyfree.c",
      "src/server.h",
      "src/t_stream.c",
      "tests/unit/type/stream.tcl"
    ],
    "estimated_context_tokens": 5790,
    "anti_shortcut_tags": []
  },
  "ground_truth": {
    "gold_patch": "TODO: extract from PR #14897",
    "test_files": [
      "tests/unit/type/stream.tcl"
    ],
    "verification_command": "TODO",
    "gold_quality_metrics": {
      "patch_locality_score": 0.0,
      "duplication_delta": 0,
      "complexity_delta": 0,
      "import_delta": 0
    }
  },
  "contamination": {
    "has_mutated_variant": false,
    "seed_pr_public": true
  },
  "metadata": {
    "long_context_tier": 1,
    "files_touched": 7,
    "modules_touched": 2,
    "languages_touched": 1,
    "reasoning_chain_length": 2,
    "extracted_by": "pr_mining",
    "human_validated": false
  }
}